{
	"$schema": "http://json-schema.org/draft-07/schema#",
	"title": "CIEmetaDigitalProduct",
	"description": "Superseded metadata schema (version 3) for digital products published by the International Commission on Illumination (CIE), in particular data tables distributed as CSV alongside CIE publications. Based on the DataCite metadata kernel with CIE-specific additions. Retained for reference only; new and revised metadata files use version 4 (v4/schema/CIEmetaDigitalProduct_schema_04.json). The accompanying description of the metadata model is published at https://github.com/CIEmetaSchemas/CIEmetaDigitalProduct (v3/docs/README.md). To validate a metadata file against this schema, any JSON Schema draft-07 validator can be used, for example https://www.jsonschemavalidator.net/ .",
	"$comment": "Based on the DataCite kernel-4.3 JSON schema:\nhttps://github.com/datacite/schema/blob/76de5e551d19e3e9b829af2f38ccc13e8c7677fe/source/json/kernel-4.3/datacite_4.3_schema.json\n\nChanges towards DataCite version 4.4:\n- field classificationCode added in the subjects field\n- address of metaschema has been changed\n- additional resourceTypeGeneral items\n- relatedItem added\n- only one identifier is allowed (as in the official schema), additional ones are introduced by \"alternateIdentifier\"\n- schemaType replaced by schemaName\n\nCIE additions:\n- checksums (recommended)\n- datatableInfo (validation, dataQuality, extrapolationMethod, interpolationMethod)\n- schemaName (required)\n- schemaVersion (required)\n- schemaURL (required)\n\nVersion history:\n3.x : schema file correction (editorial only; schemaVersion stays 3 and no published metadata file is affected). The file is now valid JSON. The descriptive header was previously written as // line comments inside the root object, which made the file unparsable by a strict JSON parser and therefore unusable with the validators recommended above. That text is now carried in description and in this $comment. The same correction was applied to version 4 of this schema.\n\nNo $id is declared. The only schema DOI CIE has minted, https://doi.org/10.25039/CIE.SC.4taqevcd, is required as the schemaURL const by both this schema and version 4, and version 4 declares it as its $id. Claiming it here as well would give two different schema documents the same canonical URI. Setting $id here requires CIE to mint a version-distinguishing identifier first; see the defect register in v4/docs/INTEROPERABILITY.md.",
	"definitions": {
		"nameType": {
			"type": "string",
			"enum": [
				"Organizational",
				"Personal"
			]
		},
		"nameIdentifiers": {
			"type": "array",
			"items": {
				"type": "object",
				"properties": {
					"nameIdentifier": {
						"type": "string"
					},
					"nameIdentifierScheme": {
						"type": "string"
					},
					"schemeURI": {
						"type": "string",
						"format": "uri"
					}
				},
				"required": [
					"nameIdentifier",
					"nameIdentifierScheme"
				]
			},
			"uniqueItems": true
		},
		"affiliations": {
			"type": "array",
			"items": {
				"type": "object",
				"properties": {
					"affiliation": {
						"type": "string"
					}
				},
				"required": [
					"affiliation"
				]
			},
			"uniqueItems": true
		},
		"titleType": {
			"type": "string",
			"enum": [
				"AlternativeTitle",
				"Subtitle",
				"TranslatedTitle",
				"Other"
			]
		},
		"contributorType": {
			"type": "string",
			"enum": [
				"ContactPerson",
				"DataCollector",
				"DataCurator",
				"DataManager",
				"Distributor",
				"Editor",
				"HostingInstitution",
				"Producer",
				"ProjectLeader",
				"ProjectManager",
				"ProjectMember",
				"RegistrationAgency",
				"RegistrationAuthority",
				"RelatedPerson",
				"Researcher",
				"ResearchGroup",
				"RightsHolder",
				"Sponsor",
				"Supervisor",
				"WorkPackageLeader",
				"Other"
			]
		},
		"date": {
			"type": "string",
			"anyOf": [
				{
					"format": "year"
				},
				{
					"format": "yearmonth"
				},
				{
					"format": "date"
				},
				{
					"format": "datetime"
				},
				{
					"format": "year-range"
				},
				{
					"format": "yearmonth-range"
				},
				{
					"format": "date-range"
				},
				{
					"format": "datetime-range"
				}
			]
		},
		"dateType": {
			"type": "string",
			"enum": [
				"Accepted",
				"Available",
				"Copyrighted",
				"Collected",
				"Created",
				"Issued",
				"Submitted",
				"Updated",
				"Valid",
				"Withdrawn",
				"Other"
			]
		},
		"interpolationMethod": {
			"type": "string",
			"enum": [
				"",
				":unal",
				":unap",
				":unas",
				"nearest",
				"linear",
				"cubic-spline",
				"cubic-Hermite",
				"Sprague",
				"Lagrange",
				"useRelatedDataset",
				"useRelatedFormula",
				"other"
			]
		},
		"extrapolationMethod": {
			"type": "string",
			"enum": [
				"",
				":unal",
				":unap",
				":unas",
				"nearest",
				"zero",
				"useRelatedDataset",
				"useRelatedFormula",
				"other"
			]
		},
		"dataQuality": {
			"type": "string",
			"enum": [
				"",
				":unap",
				":unas",
				"nominal",
				"approximated",
				"other"
			]
		},
		"resourceTypeGeneral": {
			"type": "string",
			"enum": [
				"Audiovisual",
				"Book",
				"Bookchapter",
				"Collection",
				"ComputationalNotebook",
				"ConferencePaper",
				"ConferenceProceeding",
				"DataPaper",
				"Dataset",
				"Dissertation",
				"Event",
				"Image",
				"InteractiveResource",
				"Journal",
				"JournalArticle",
				"Model",
				"OutputManagementPlan",
				"PeerReview",
				"PhysicalObject",
				"Preprint",
				"Report",
				"Service",
				"Software",
				"Sound",
				"Standard",
				"Text",
				"Workflow",
				"Other"
			]
		},
		"relatedIdentifierType": {
			"type": "string",
			"enum": [
				"ARK",
				"arXiv",
				"bibcode",
				"DOI",
				"EAN13",
				"EISSN",
				"Handle",
				"IGSN",
				"ISBN",
				"ISSN",
				"ISTC",
				"LISSN",
				"LSID",
				"PMID",
				"PURL",
				"UPC",
				"URL",
				"URN",
				"w3id"
			]
		},
		"relationType": {
			"type": "string",
			"enum": [
				"IsCitedBy",
				"Cites",
				"IsSupplementTo",
				"IsSupplementedBy",
				"IsContinuedBy",
				"Continues",
				"IsDescribedBy",
				"Describes",
				"HasMetadata",
				"IsMetadataFor",
				"HasVersion",
				"IsVersionOf",
				"IsNewVersionOf",
				"IsPreviousVersionOf",
				"IsPartOf",
				"HasPart",
				"IsPublishedIn",
				"IsReferencedBy",
				"References",
				"IsDocumentedBy",
				"Documents",
				"IsCompiledBy",
				"Compiles",
				"IsVariantFormOf",
				"IsOriginalFormOf",
				"IsIdenticalTo",
				"IsReviewedBy",
				"Reviews",
				"IsDerivedFrom",
				"IsSourceOf",
				"IsRequiredBy",
				"Requires",
				"IsObsoletedBy",
				"Obsoletes"
			]
		},
		"descriptionType": {
			"type": "string",
			"enum": [
				"Abstract",
				"Methods",
				"SeriesInformation",
				"TableOfContents",
				"TechnicalInfo",
				"Other"
			]
		},
		"geoLocationPoint": {
			"type": "object",
			"properties": {
				"pointLongitude": {
					"$ref": "#/definitions/longitude"
				},
				"pointLatitude": {
					"$ref": "#/definitions/latitude"
				}
			},
			"required": [
				"pointLongitude",
				"pointLatitude"
			]
		},
		"longitude": {
			"type": "number",
			"minimum": -180,
			"maximum": 180
		},
		"latitude": {
			"type": "number",
			"minimum": -90,
			"maximum": 90
		},
		"funderIdentifierType": {
			"type": "string",
			"enum": [
				"ISNI",
				"GRID",
				"Crossref Funder ID",
				"Other"
			]
		}
	},
	"type": "object",
	"properties": {
		"types": {
			"type": "object",
			"properties": {
				"resourceType": {
					"type": "string"
				},
				"resourceTypeGeneral": {
					"$ref": "#/definitions/resourceTypeGeneral"
				}
			},
			"required": [
				"resourceType",
				"resourceTypeGeneral"
			]
		},
		"identifier": {
			"type": "object",
			"properties": {
				"identifier": {
					"type": "string"
				},
				"identifierType": {
					"type": "string"
				}
			},
			"required": [
				"identifier",
				"identifierType"
			]
		},
		"creators": {
			"type": "array",
			"items": {
				"type": "object",
				"properties": {
					"name": {
						"type": "string"
					},
					"nameType": {
						"$ref": "#/definitions/nameType"
					},
					"givenName": {
						"type": "string"
					},
					"familyName": {
						"type": "string"
					},
					"nameIdentifiers": {
						"$ref": "#/definitions/nameIdentifiers"
					},
					"affiliations": {
						"$ref": "#/definitions/affiliations"
					},
					"lang": {
						"type": "string"
					}
				},
				"required": [
					"name"
				]
			},
			"minItems": 1,
			"uniqueItems": true
		},
		"titles": {
			"type": "array",
			"items": {
				"type": "object",
				"properties": {
					"title": {
						"type": "string"
					},
					"titleType": {
						"$ref": "#/definitions/titleType"
					},
					"lang": {
						"type": "string"
					}
				},
				"required": [
					"title"
				]
			},
			"minItems": 1,
			"uniqueItems": true
		},
		"publisher": {
			"type": "string"
		},
		"publicationYear": {
			"type": "string",
			"format": "year"
		},
		"subjects": {
			"type": "array",
			"items": {
				"type": "object",
				"properties": {
					"subject": {
						"type": "string"
					},
					"subjectScheme": {
						"type": "string"
					},
					"schemeURI": {
						"type": "string",
						"format": "uri"
					},
					"valueURI": {
						"type": "string",
						"format": "uri"
					},
					"classificationCode": {
						"type": "string"
					},
					"lang": {
						"type": "string"
					}
				},
				"required": [
					"subject"
				]
			},
			"uniqueItems": true
		},
		"contributors": {
			"type": "array",
			"items": {
				"type": "object",
				"properties": {
					"contributorType": {
						"$ref": "#/definitions/contributorType"
					},
					"name": {
						"type": "string"
					},
					"nameType": {
						"$ref": "#/definitions/nameType"
					},
					"givenName": {
						"type": "string"
					},
					"familyName": {
						"type": "string"
					},
					"nameIdentifiers": {
						"$ref": "#/definitions/nameIdentifiers"
					},
					"affiliations": {
						"$ref": "#/definitions/affiliations"
					},
					"lang": {
						"type": "string"
					}
				},
				"required": [
					"contributorType",
					"name"
				]
			},
			"uniqueItems": true
		},
		"dates": {
			"type": "array",
			"items": {
				"type": "object",
				"properties": {
					"date": {
						"$ref": "#/definitions/date"
					},
					"dateType": {
						"$ref": "#/definitions/dateType"
					},
					"dateInformation": {
						"type": "string"
					}
				},
				"required": [
					"date",
					"dateType"
				]
			},
			"uniqueItems": true
		},
		"language": {
			"type": "string",
			"$comment": "Primary language of the resource. Allowed values are taken from  IETF BCP 47, ISO 639-1 language codes."
		},
		"alternateIdentifiers": {
			"type": "array",
			"items": {
				"type": "object",
				"properties": {
					"alternateIdentifier": {
						"type": "string"
					},
					"alternateIdentifierType": {
						"type": "string"
					}
				},
				"required": [
					"alternateIdentifier",
					"alternateIdentifierType"
				]
			},
			"uniqueItems": true
		},
		"relatedIdentifiers": {
			"type": "array",
			"items": {
				"type": "object",
				"properties": {
					"relatedIdentifier": {
						"type": "string"
					},
					"relatedIdentifierType": {
						"$ref": "#/definitions/relatedIdentifierType"
					},
					"relationType": {
						"$ref": "#/definitions/relationType"
					},
					"relatedMetadataScheme": {
						"type": "string"
					},
					"schemeURI": {
						"type": "string",
						"format": "uri"
					},
					"schemeType": {
						"type": "string"
					},
					"resourceTypeGeneral": {
						"$ref": "#/definitions/resourceTypeGeneral"
					}
				},
				"required": [
					"relatedIdentifier",
					"relatedIdentifierType",
					"relationType"
				],
				"if": {
					"properties": {
						"relationType": {
							"enum": [
								"HasMetadata",
								"IsMetadataFor"
							]
						}
					}
				},
				"else": {
					"$comment": "these properties may only be used with relation types HasMetadata/IsMetadataFor",
					"properties": {
						"relatedMetadataScheme": false,
						"schemeURI": false,
						"schemeType": false
					}
				}
			},
			"uniqueItems": true
		},
		"sizes": {
			"type": "array",
			"items": {
				"type": "string"
			},
			"uniqueItems": true
		},
		"formats": {
			"type": "array",
			"items": {
				"type": "string"
			},
			"uniqueItems": true
		},
		"version": {
			"type": "string"
		},
		"rightsList": {
			"type": "array",
			"items": {
				"type": "object",
				"properties": {
					"rights": {
						"type": "string"
					},
					"rightsURI": {
						"type": "string",
						"format": "uri"
					},
					"rightsIdentifier": {
						"type": "string"
					},
					"rightsIdentifierScheme": {
						"type": "string"
					},
					"schemeURI": {
						"type": "string",
						"format": "uri"
					},
					"lang": {
						"type": "string"
					}
				}
			},
			"uniqueItems": true
		},
		"descriptions": {
			"type": "array",
			"items": {
				"type": "object",
				"properties": {
					"description": {
						"type": "string"
					},
					"descriptionType": {
						"$ref": "#/definitions/descriptionType"
					},
					"lang": {
						"type": "string"
					}
				},
				"required": [
					"description",
					"descriptionType"
				]
			},
			"uniqueItems": true
		},
		"geoLocations": {
			"type": "array",
			"items": {
				"type": "object",
				"properties": {
					"geoLocationPlace": {
						"type": "string"
					},
					"geoLocationPoint": {
						"$ref": "#/definitions/geoLocationPoint"
					},
					"geoLocationBox": {
						"type": "object",
						"properties": {
							"westBoundLongitude": {
								"$ref": "#/definitions/longitude"
							},
							"eastBoundLongitude": {
								"$ref": "#/definitions/longitude"
							},
							"southBoundLatitude": {
								"$ref": "#/definitions/latitude"
							},
							"northBoundLatitude": {
								"$ref": "#/definitions/latitude"
							}
						},
						"required": [
							"westBoundLongitude",
							"eastBoundLongitude",
							"southBoundLatitude",
							"northBoundLatitude"
						]
					},
					"geoLocationPolygons": {
						"type": "array",
						"items": {
							"type": "object",
							"properties": {
								"polygonPoints": {
									"type": "array",
									"items": {
										"$ref": "#/definitions/geoLocationPoint"
									},
									"minItems": 4
								},
								"inPolygonPoint": {
									"$ref": "#/definitions/geoLocationPoint"
								}
							},
							"required": [
								"polygonPoints"
							]
						},
						"uniqueItems": true
					}
				}
			},
			"uniqueItems": true
		},
		"fundingReferences": {
			"type": "array",
			"items": {
				"type": "object",
				"properties": {
					"funderName": {
						"type": "string"
					},
					"funderIdentifier": {
						"type": "string"
					},
					"funderIdentifierType": {
						"$ref": "#/definitions/funderIdentifierType"
					},
					"awardNumber": {
						"type": "string"
					},
					"awardURI": {
						"type": "string",
						"format": "uri"
					},
					"awardTitle": {
						"type": "string"
					}
				},
				"required": [
					"funderName"
				]
			},
			"uniqueItems": true
		},
		"relatedItems": {
			"type": "array",
			"items": {
				"type": "object",
				"properties": {
					"relatedItemType": {
						"$ref": "#/definitions/resourceTypeGeneral"
					},
					"relationType": {
						"$ref": "#/definitions/relationType"
					},
					"relatedItemIdentifier": {
						"type": "string"
					},
					"relatedItemIdentifierType": {
						"$ref": "#/definitions/relatedIdentifierType"
					},
					"relatedMetadataScheme": {
						"type": "string"
					},
					"schemeURI": {
						"type": "string",
						"format": "uri"
					},
					"schemeType": {
						"type": "string"
					},
					"resourceTypeGeneral": {
						"$ref": "#/definitions/resourceTypeGeneral"
					}
				},
				"required": [
					"relatedItemType",
					"relationType"
				],
				"if": {
					"properties": {
						"relationType": {
							"enum": [
								"HasMetadata",
								"IsMetadataFor"
							]
						}
					}
				},
				"else": {
					"$comment": "these properties may only be used with relation types HasMetadata/IsMetadataFor",
					"properties": {
						"relatedMetadataScheme": false,
						"schemeURI": false,
						"schemeType": false
					}
				}
			},
			"uniqueItems": true
		},
		"schemaName": {
			"type": "string",
			"const": "CIEmetaDigitalProduct"
		},
		"schemaVersion": {
			"type": "number",
			"const": 3
		},
		"schemaURL": {
			"type": "string",
			"const": "https://doi.org/10.25039/CIE.SC.4taqevcd"
		},		
		"datatableInfo": {
			"type": "object",
			"properties": {
				"interpolationMethod": {
					"$ref": "#/definitions/interpolationMethod"
				},
				"extrapolationMethod": {
					"$ref": "#/definitions/extrapolationMethod"
				},
				"dataQuality": {
					"$ref": "#/definitions/dataQuality"
				},
				"validations": {
					"type": "array",
					"items": {
						"type": "object",
						"properties": {
							"validationType": {
								"type": "string"
							},
							"validationAlgorithm": {
								"type": "string"
							},
							"validationParameter": {
								"type": "string"
							},
							"validationValue": {
								"type": "string"
							}
						}
					},
					"uniqueItems": true
				},
				"columnHeaders": {
					"type": "array",
					"items": {
						"type": "object",
						"properties": {
							"title": {
								"type": "string"
							},
							"unit": {
								"type": "string"
							},
							"quantity": {
								"type": "string"
							},
							"description": {
								"type": "string"
							}
						}
					},
					"uniqueItems": true
				}
			}
		},
		"checksums": {
			"type": "array",
			"items": {
				"type": "object",
				"properties": {
					"hashMethod": {
						"type": "string"
					},
					"checksum": {
						"type": "string"
					}
				},
				"required": [
					"hashMethod",
					"checksum"
				]
			},
			"uniqueItems": true
		}
	},
	"required": [
		"identifier",
		"creators",
		"titles",
		"publisher",
		"publicationYear",
		"types",
		"schemaName",
		"schemaVersion",
		"schemaURL"
	]
}
